{
  "schema_version": "1.0",
  "kind": "wawalu.integration.hris-org",
  "export_id": "10000000-0000-4000-8000-000000000003",
  "snapshot": {
    "source_instance_id": "psn_hris_demo_00000001",
    "sequence": 40,
    "generated_at": "2026-07-22T12:00:00Z",
    "mode": "delta",
    "completeness": "complete",
    "omitted_record_count": 0,
    "issues": []
  },
  "privacy": {
    "identifier_method": "hmac-sha256-truncated",
    "direct_identifiers_included": false,
    "salt_scope": "tenant-integration-v1"
  },
  "records": []
}
